{
  "version": "6.0.0-core",
  "data_types": [
    {
      "id": "ds.mova_schema_core_v1",
      "title": "Core ds form",
      "description": "Core service fields for MOVA data records (schema_id, schema_version, meta, ext).",
      "schema_ref": "https://mova.dev/schemas/ds.mova_schema_core_v1.schema.json"
    },
    {
      "id": "ds.mova_episode_core_v1",
      "title": "Core episode",
      "description": "Minimal common structure for all MOVA episodes.",
      "schema_ref": "https://mova.dev/schemas/ds.mova_episode_core_v1.schema.json"
    },
    {
      "id": "ds.mova4_core_catalog_v1",
      "title": "MOVA core catalog",
      "description": "Canonical structure for the MOVA core catalog (data_types, verbs, envelopes, episode_types).",
      "schema_ref": "https://mova.dev/schemas/ds.mova4_core_catalog_v1.schema.json"
    },
    {
      "id": "ds.security_event_episode_core_v1",
      "title": "Core security event episode",
      "description": "Specialization of the core episode for security-relevant events with policy reference and actions.",
      "schema_ref": "https://mova.dev/schemas/ds.security_event_episode_core_v1.schema.json"
    },
    {
      "id": "ds.instruction_profile_core_v1",
      "title": "Core instruction profile",
      "description": "Defines instruction and guardrail profiles for executors, roles and envelopes.",
      "schema_ref": "https://mova.dev/schemas/ds.instruction_profile_core_v1.schema.json"
    },
    {
      "id": "ds.runtime_binding_core_v1",
      "title": "Core runtime binding",
      "description": "Neutral description of how MOVA scenarios/skills are bound to execution runtimes.",
      "schema_ref": "https://mova.dev/schemas/ds.runtime_binding_core_v1.schema.json"
    },
    {
      "id": "ds.connector_core_v1",
      "title": "Core connector",
      "description": "Neutral description of a connector to an external system (API, service, data source).",
      "schema_ref": "https://mova.dev/schemas/ds.connector_core_v1.schema.json"
    },
    {
      "id": "ds.ui_text_bundle_core_v1",
      "title": "Core UI text bundle",
      "description": "UI text bundle with strict separation between human-facing text and model instructions.",
      "schema_ref": "https://mova.dev/schemas/ds.ui_text_bundle_core_v1.schema.json"
    }
  ],
  "verbs": [
    {
      "id": "create",
      "description": "Create a new record."
    },
    {
      "id": "update",
      "description": "Update an existing record."
    },
    {
      "id": "route",
      "description": "Route a request/click to one of many targets."
    },
    {
      "id": "record",
      "description": "Record an episode or observation."
    },
    {
      "id": "publish",
      "description": "Publish a catalog or configuration to executors."
    }
  ],
  "envelopes": [
    {
      "id": "env.instruction_profile_publish_v1",
      "verb": "publish",
      "description": "Publish a MOVA instruction profile to an executor or guard.",
      "input_types": [
        "ds.instruction_profile_core_v1"
      ],
      "output_types": []
    },
    {
      "id": "env.mova4_core_catalog_publish_v1",
      "verb": "publish",
      "description": "Publish the MOVA core catalog to a registry.",
      "input_types": [],
      "output_types": [
        "ds.mova4_core_catalog_v1"
      ]
    },
    {
      "id": "env.security_event_store_v1",
      "verb": "record",
      "description": "Record a security event episode in a security store or log.",
      "input_types": [
        "ds.security_event_episode_core_v1"
      ],
      "output_types": []
    }
  ],
  "episode_types": [
    {
      "id": "ds.mova_episode_core_v1",
      "description": "Base type for all generic episode schemas in MOVA.",
      "schema_ref": "https://mova.dev/schemas/ds.mova_episode_core_v1.schema.json"
    },
    {
      "id": "ds.security_event_episode_core_v1",
      "description": "Base type for security event episodes in MOVA.",
      "schema_ref": "https://mova.dev/schemas/ds.security_event_episode_core_v1.schema.json"
    }
  ]
}
